{
  "general": {
    "experimentID": "eR8ENvJPgQth",
    "app_name": "O-TUD",
    "version": "1.0.0",
    "author": "John Doe",
    "language": "en",
    "instructions": true,
    "primary_redirect_url": "pages/thank-you.html",
    "fallbackToCSV": true,
    "accessibility": {
      "enableReducedMotion": false,
      "enableHighContrast": false,
      "enableForcedColors": false,
      "autoscrollSpeed": 32
    }
  },
  "day_boundary": "04:00",
  "instructions": [
    {
      "title": "1. Select a Timeline",
      "text": "Use the <strong>timeline picker</strong> to switch timelines. Each timeline records different information about your day. When you switch you will see information about what each timeline is for.",
      "spotlight": [
        50,
        2,
        18
      ],
      "image": "timeline-picker.png"
    },
    {
      "title": "2. Pick a start time",
      "text": "Click or tap on the timeline to indicate the start time, you can always adjust this in the next step",
      "spotlight": [
        50,
        50,
        40
      ],
      "modalTop": "450"
    },
    {
      "title": "3. Add activity details",
      "text": "Use the activity picker to fill out the activity details",
      "spotlight": [
        50,
        90,
        20
      ],
      "modalTop": "-450",
      "showPanel": "activity"
    },
    {
      "title": "4. Submit your diary",
      "text": "Once you've recorded all your activities for the day, click the Submit button to complete your diary.",
      "spotlight": [
        50,
        10,
        20
      ]
    }
  ],
  "timeline": [
    {
      "name": "Primary activity",
      "description": "What were you doing? Please write down one main activity",
      "mode": "single-choice",
      "min_coverage": "10",
      "allow_free_text": true,
      "categories": [
        {
          "name": "Personal",
          "activities": [
            {
              "name": "Sleeping",
              "code": 101,
              "label": "sleeping",
              "short": "sleep",
              "vshort": "slp",
              "color": "#a2b4ee",
              "childItems": []
            },
            {
              "name": "Resting",
              "code": 102,
              "label": "resting",
              "short": "rest",
              "vshort": "rst",
              "color": "#a2e0da",
              "childItems": [
                {
                  "name": "Resting - Time out"
                },
                {
                  "name": "Sick in bed"
                }
              ]
            },
            {
              "name": "Washing, Dressing",
              "code": 103,
              "label": "washing, dressing",
              "short": "wash/dress",
              "vshort": "wsh",
              "color": "#b3d6c0",
              "childItems": [
                {
                  "name": "Washing and dressing",
                  "code": 103,
                  "label": "washing, dressing",
                  "short": "wash/dress",
                  "vshort": "wsh",
                  "color": "#b3d6c0"
                },
                {
                  "name": "Other personal care"
                }
              ]
            },
            {
              "name": "Eating, Drinking, Meal (At Home or Work)",
              "code": 104,
              "label": "eating, drinking, meal, at home or work",
              "short": "eat in",
              "vshort": "eat",
              "color": "#e0e7cd",
              "childItems": []
            },
            {
              "name": "Preparing Food, Cooking, Washing Up",
              "code": 105,
              "label": "preparing food, cooking, washing up",
              "short": "prp food",
              "vshort": "prep",
              "color": "#f1daf5",
              "childItems": [
                {
                  "name": "Food preparation and baking",
                  "code": 105,
                  "label": "preparing food, cooking, washing up",
                  "short": "prp food",
                  "vshort": "prep",
                  "color": "#f1daf5"
                },
                {
                  "name": "Dish washing",
                  "code": 105,
                  "label": "preparing food, cooking, washing up",
                  "short": "prp food",
                  "vshort": "prep",
                  "color": "#f1daf5"
                },
                {
                  "name": "Storing, arranging, preserving food stocks",
                  "code": 105,
                  "label": "preparing food, cooking, washing up",
                  "short": "prp food",
                  "vshort": "prep",
                  "color": "#f1daf5"
                }
              ]
            },
            {
              "name": "Services (e.g., Doctor, Dentist, Hairdresser)",
              "code": 109,
              "label": "services eg. doctor/dentist/hairdresser",
              "short": "personal services",
              "vshort": "serv",
              "color": "#f5b9ac",
              "childItems": []
            },
            {
              "name": "Church, Temple, Mosque, Synagogue, Prayer",
              "code": 110,
              "label": "church, temple, mosque, synagogue, prayer",
              "short": "religion",
              "vshort": "rel",
              "color": "#c0c5df",
              "childItems": [
                {
                  "name": "Religious activities",
                  "code": 110,
                  "label": "church, temple, mosque, synagogue, prayer",
                  "short": "religion",
                  "vshort": "rel",
                  "color": "#c0c5df"
                },
                {
                  "name": "Visits to cemetery and grave care",
                  "code": 110,
                  "label": "church, temple, mosque, synagogue, prayer",
                  "short": "religion",
                  "vshort": "rel",
                  "color": "#c0c5df"
                }
              ]
            }
          ]
        },
        {
          "name": "Unpaid Work",
          "activities": [
            {
              "name": "Cleaning, Tidying House",
              "code": 106,
              "label": "cleaning tidying house",
              "short": "tidy",
              "vshort": "tdy",
              "color": "#d8bcf0",
              "childItems": [
                {
                  "name": "Cleaning dwelling",
                  "code": 106,
                  "label": "cleaning tidying house",
                  "short": "tidy",
                  "vshort": "tdy",
                  "color": "#d8bcf0"
                },
                {
                  "name": "Cleaning garden",
                  "code": 106,
                  "label": "cleaning tidying house",
                  "short": "tidy",
                  "vshort": "tdy",
                  "color": "#d8bcf0"
                },
                {
                  "name": "Arranging household goods and materials",
                  "code": 106,
                  "label": "cleaning tidying house",
                  "short": "tidy",
                  "vshort": "tdy",
                  "color": "#d8bcf0"
                },
                {
                  "name": "Recycling and disposal of waste",
                  "code": 106,
                  "label": "cleaning tidying house",
                  "short": "tidy",
                  "vshort": "tdy",
                  "color": "#d8bcf0"
                },
                {
                  "name": "Other household upkeep",
                  "code": 106,
                  "label": "cleaning tidying house",
                  "short": "tidy",
                  "vshort": "tdy",
                  "color": "#d8bcf0"
                }
              ]
            },
            {
              "name": "Clothes Washing, Mending, Sewing",
              "code": 107,
              "label": "clothes washing, mending, sewing",
              "short": "wash/cloth",
              "vshort": "clth",
              "color": "#96b3f8",
              "childItems": [
                {
                  "name": "Laundry",
                  "code": 107,
                  "label": "clothes washing, mending, sewing",
                  "short": "wash/cloth",
                  "vshort": "clth",
                  "color": "#96b3f8"
                },
                {
                  "name": "Ironing",
                  "code": 107,
                  "label": "clothes washing, mending, sewing",
                  "short": "wash/cloth",
                  "vshort": "clth",
                  "color": "#96b3f8"
                },
                {
                  "name": "Other textile care (e.g. mending)",
                  "code": 107,
                  "label": "clothes washing, mending, sewing",
                  "short": "wash/cloth",
                  "vshort": "clth",
                  "color": "#96b3f8"
                }
              ]
            },
            {
              "name": "Maintenance of House, DIY, Gardening, Pet Care",
              "code": 108,
              "label": "maintenance of house, DIY, gardening",
              "short": "DIY",
              "vshort": "DIY",
              "color": "#f6eef3",
              "childItems": [
                {
                  "name": "Gardening",
                  "code": 108,
                  "label": "maintenance of house, DIY, gardening",
                  "short": "DIY",
                  "vshort": "DIY",
                  "color": "#f6eef3"
                },
                {
                  "name": "Tending domestic animals",
                  "code": 108,
                  "label": "maintenance of house, DIY, gardening",
                  "short": "DIY",
                  "vshort": "DIY",
                  "color": "#f6eef3"
                },
                {
                  "name": "Caring for pets",